#mad,laidback0210,2016-11-08 09:55:31,☆OFFICIAL BLOG更新しました☆ Moonage Devilment新作入荷情報です。 http:// ameblo.jp/laid-back111/e ntry-12217581895.html … #moonagedevilment #ムーンエイジデビルメント #mad #kiyoharu #清春 #ウールライダースコート #浜松 pic.twitter.com/KIee2DU5HX
#mad,earthnationlive,2016-11-08 09:02:01,"Here's some #mad #happy #boogie #bounce from the #kitties and #cats @ShinobiNinja https://www. youtube.com/watch?list=PL3 7006E2F152B120F&v=mPd2nQnOSb8 … big up from #Brooklyn , y'all! <3<3"
#mad,DirhamMarocain,2016-11-08 09:00:03,"09:00 08 Nov #MAD USD = 9,80 EUR = 10,83 CAD = 7,33 GBP = 12,15 CNY = 1,45 RUB = 0,15"
#mad,thuytranchau,2016-11-08 08:49:39,When U're #MAD but someone gives U #snacks .... @p2662 & @corvanerp I do look like this Little girl https://www. facebook.com/9gag/videos/10 155103759931840/ …
#mad,Worldgaminn,2016-11-08 08:37:19,RT: RT ezonecom: Cheer up... it's coming soon! http:// ezone.com/jointhedots #indiegamedev #mad … pic.twitter.com/hTSRMajgf2 pic.twitter.com/aF80TMkLEj
#mad,Syamu_Meisaku,2016-11-08 08:36:43,【不定期】 syamu_game の名作MAD等をBotで紹介しているだで。 よければフォロしてね！ #syamu_game #syamu #シャム #貝塚勃起土竜 #MAD #名作 #syamu_bot #syamuBot #MADbot #拡散希望
#mad,AYEMofc,2016-11-08 08:33:23,capucine c vraiment 1 grosse menteuse ! elle était en chien sur thomas ds les anges avec qui on l'aurait obligé à sortir ? #TPMP #MAD
#mad,wiki_madrid,2016-11-08 08:22:09,Un muerto por un incendio en una residencia de ancianos en San Sebastián de los Reyes http:// ift.tt/2fyCUhM #Mad … pic.twitter.com/cEyBRPXvPs
#mad,audioslugs,2016-11-08 08:17:42,It's #cold #beats #bass #trap #Grime #140 #mad #electronic #producer #audioslugs #music … https://www. instagram.com/p/BMisqW2gCA0/
#mad,NCGWOLFGANG,2016-11-08 08:08:27,I can't stop listening to @TheBugzyMalone #mad puts me in a different level. Fucking up the morning #turnintothedevil
#mad,thefranj,2016-11-08 08:04:39,"#USA /Frehcn phonetic"" #Trump -er"">(se)Tromper>make #mistake . If such a thing happen tomorrow =? #Destiny want a #mad against mad #religious men"
#mad,buscavuelos,2016-11-08 08:02:58,"Madrid a Dubái a mediados de noviembre, 318 euros. #MAD #DXB http://www. comprarvuelosbaratos.com/vuelos/desde-M AD/hasta-DXB/informe.html …"
#mad,DirhamMarocain,2016-11-08 08:00:04,"08:00 08 Nov #MAD USD = 9,80 EUR = 10,83 CAD = 7,33 GBP = 12,17 CNY = 1,45 RUB = 0,15"
#mad,yunakashima,2016-11-08 06:47:35,#mad tv sexy pictures of lesbiens having sex http:// 562.vip-dat.ga
#furious,starfishncoffee,2016-11-16 22:42:15,"#Furious Led by Elizabeth Warren and Bernie, the Democrats are screwing up the Trump resistance: http://www. slate.com/articles/news_ and_politics/politics/2016/11/the_democrats_are_already_screwing_up_the_trump_resistance.html?wpsrc=sh_all_dt_tw_ru … via @slate"
#furious,jrooney1991,2016-11-16 20:31:07,Thnx @bt_uk forletting me know my internet is going to be a day later than the two weeks it's already late. and you've charged for! #furious
#furious,cabacaceresxoxo,2016-11-16 05:32:24,Have you ever made a decision you immediately regretted? Me just now smh #furious
#furious,symbioticon,2016-11-16 00:07:33,"nicht die Großen fressen die Kleinen, sondern die Schnellen die Langsamen. #symbioticon #fast but not #furious https:// twitter.com/JulianSchueman n/status/798673006641971200 …"
#furious,SurlyRepMN,2016-11-15 19:07:04,HEAVY METAL PIZZA! Tonight at @PizzeriaLola ! #Darkness #DoubleBarrelPentagram #Axeman #Hell #Furious #Abrasive #GetSurly 4PM Do it! pic.twitter.com/Gb7lHyumwj
#furious,DanaBrookeWWE,2016-11-15 15:28:27,My #glamsquad just #slays every week! #fierce & #furious !! Love my girls toni_mua on the… https://www. instagram.com/p/BM1fjQKhX35/
#furious,smshashiprasad,2016-11-14 13:19:50,One of my friend is v #furious dat despite lakhs n lakhs of #astrologers in #India none predicted @narendramodi 's #DeMonetisation move
#furious,louiegraphy,2016-11-14 01:05:39,#LessonLearned : Never! I repeat NEVER ask anyone to do something for you if you think you can do it better and do it right. #furious
#furious,BigRichTexasPam,2016-11-13 16:09:44,@GregAbbott_TX @GovernorPerry @TxDPS @realDonaldTrump @TXAG HOW in GODS name 3 cities in TEXAS #sanctuarycities #BuildTheWall #furious https:// twitter.com/johnkstahlusa/ status/797446066165583872 …
#furious,jwharville,2016-11-13 00:00:04,Bye Gus. You're done. But not really because we know nothing will change. #furious
#furious,furiousgazelle,2016-11-12 19:50:35,"Hate the world? Let us know! If anything makes you #furious , ANYTHING, then send a tightly written rant here http:// bit.ly/1eez7TX"
#furious,DrG031,2016-11-12 05:59:15,"I ain't healing no divide.I'm pissed,I'm organizing,and I'm working towards the #midterms . What's the saying?Hell hath no fury? I'm #FURIOUS https:// twitter.com/karnythia/stat us/797303191079686144 …"
#furious,emilyaspain,2016-11-11 23:59:01,Running into Trump supporters from New York in Dublin = #whywouldyoudosuchathing #furious #angry #elections2016
#furious,akmk,2016-11-11 05:07:15,Exactly..but let's be proud of our false equivalencies and protest votes/non-votes. #furious #nightmarenation https:// twitter.com/leahmcelrath/s tatus/796884665084866560 …
#furious,AlexFelton6,2016-11-10 21:51:38,In the mood to kill someone. Lemme know if you're interested #i #am #furious
#furious,CharlesCrawford,2016-11-10 09:15:53,In which an angry white @guardian writer sounds angry and white in lamenting white angry voters #sleepless #furious #angry #white https:// twitter.com/HadleyFreeman/ status/796631730618855424 …
#furious,sarah_potts99,2016-11-10 03:48:21,I AM DELETING SOCIAL MEDIA UNTIL THIS COOLS DOWN THANKS TO EVERYONE FOR RUINING THE PLACES WHERE I FOUND FUNNY MEMES!!!!! #furious
#furious,_Trinity_GX,2016-11-09 21:52:36,My stream got a copyright claim due to this scrub blasting his music through the mic in a middle of the game... I muted... But... #furious
#furious,JeffDavies206,2016-11-09 18:07:33,The dumb f%cks have spoken. #furious #notmypresdient
#furious,Doll2Dame,2016-11-09 17:09:41,"FYI if you did a provisional ballot, the envelope needed to be signed in order for your ballot to be counted. I was not told that! #furious"
#furious,MarkBarzin,2016-11-09 16:45:37,"“An #intense & #furious , #metal #hiphop track, made even more so by Openshore’s vocalist, Mark Watt!” #music #listen http:// ow.ly/TE3L300P2FT"
#furious,newsoneplace,2016-11-09 14:53:12,(International Business Times): #Furious #MPs demand explanation from Mike Ashley over 'bugging' of Sports.. http://www. newsoneplace.com/article/109218 71607/furious-mps-mike-ashley-sports-direct-demand-explanation-bugging …
#furious,PaigeZidek,2016-11-09 14:44:35,More appropriate than ever to binge listen to #RunTheJewels today. #Furious
#furious,babyhuff,2016-11-09 12:28:22,Can I go back to bed and wake up in an alternate universe where the most qualified person to ever run actually becomes president? #furious
#furious,claireryerson47,2016-11-09 11:31:39,"This just great...... #Furious my world comes to an end...... Donald you're a disgrace to my country... if your going to lead, do right"
#furious,TimProtteyJones,2016-11-09 10:22:01,This is a travesty! No more Celebrity Apprentice USA!!! #furious #cross
#furious,MGowerSull,2016-11-09 07:30:36,Let their be no mistake @MSNBC @CNN @NateSilver538 All #Pollsters & #Pundits We @HillaryClinton supporters are #Furious w/ you #CuttingCord
#furious,NottsAnaconda,2016-11-09 07:17:43,#fast #furious #fun and okay maybe #freezing but when the adrenaline's pumping you don't feel it! #HenleyWinterSeries pic.twitter.com/5syb4DVJLt
#furious,mayaoliviaaa,2016-11-09 07:05:17,FMLLLLLL bought the wrong glee song #vexed #furious pic.twitter.com/SkKZaQ01Yp
#furious,tauschbude,2016-11-09 06:58:37,Zum Tausch freigegeben: The Fast and the Furious mit Vin Diesel #Fast #& #Furious #Vin #Diesel #Sony #Pictures http:// de.tauschbu.de/art/12cb7961a? social=1 …
#furious,ThatLadOnTheBar,2016-11-09 04:57:18,I don't think these idiots are aware of the damage that's about to be caused electing that melt #Furious #WhenUTweetITweet
#furious,JennaOrlowski,2016-11-09 04:56:42,This shouldn't have happened #wtf #imwithher #furious
#furious,furiousgazelle,2016-11-09 02:43:23,Fuck New Hampshire. #furious #electionnight #icanteven
#furious,TheBoudicca,2016-11-09 02:27:57,"Believe me, i am exercising great restraint online right now. #furious #Election2016"
#furious,studio987,2016-11-09 02:22:37,"Now Playing: #Grandmaster Flash & The #Furious Five - New York, New York - http://www. channel80.de"
#furious,Helenn_Ly,2016-11-08 23:20:35,"Was about to order my tickets for the Light Festival this Saturday, but they're ALL sold out already!! I am #furious"
#furious,edegenias,2016-11-08 20:18:36,Charlie Garforth #Furious @jed010115 @@scorchy @AwesomeMuscle @Aussie_Dudes @81TakTsukada18 @randysemhgts pic.twitter.com/5UguZd6pk0
#furious,RadioRockyBlues,2016-11-08 18:49:28,#Radionomy #Follow #love #Nowplaying #Furious zoo #The Witch Blues - http://www. radiorocknblues.fr
#furious,SameTiego,2016-11-08 14:27:27,Literally this is so unforgivable like i hate u now!! #furious
#furious,mp3explore,2016-11-08 13:59:57,"fast and furious http:// wallpaperClicker.Com/rw/17538498/ #fast #furious ,"
#furious,studio987,2016-11-08 12:45:02,Now Playing: #Grandmaster Melle Mel & The #Furious 5 - #Continuous White Lines - http://www. channel80.de
#furious,PamposHD,2016-11-08 10:15:32,Been kicked out 2wice from fut !!! #furious #FUTChampions #FIFA17
#furious,JUSTFUKNBAD__,2016-11-08 08:34:43,Every time I think about it I get #furious !!!!
#sad,mitchellvii,2016-11-16 22:55:48,You know what's sad? #Hillbots still trying. #Sad .
#sad,Pausanias,2016-11-16 21:43:58,"Seit @GescheJoost , Franka, Miriam und @holadiho 's Tochter gegangen sind, stehen hier nur noch Krawatten rum. #sad #itg16"
#sad,JasamDnA,2016-11-16 19:28:34,Franco is a good rapist. Tom is a Bad rapist. This is what @PFossil message as a woman to other women is? #gh #sad #comeon #dobetter
#sad,cutepeacelover,2016-11-16 13:25:06,"""The dreams in some eyes, will drain away with the tears in them!"" #sad #reality #life pic.twitter.com/AZmZAff2ZX"
#sad,lvpandeR,2016-11-14 17:03:48,A ver la superluna más solo que la una. #microcuento #sad
#sad,camilamyboss,2016-11-14 04:47:16,"igual que feo por lucy, que a lauren se le vayan los ojos todo el tiempo viendo a camila #sad"
#sad,MrChuckD,2016-11-14 02:51:25,"Racists dont really just dont want folks of color to leave the USA , they really deep down want us to leave the earth #sad"
#sad,JhaSanjay,2016-11-13 06:33:51,"A young man tells me he could not deposit cash as the queues were too long. Now his cheques may bounce, which is a criminal offense. #Sad"
#sad,marspet,2016-11-12 23:42:23,HAHHA omggggg ich hab grad meine alten #ibes Tweets wiedergefunden... OMG WANN LÄUFT DAS WIEDER??? #missit #sad #cry
#sad,Debnicolina,2016-11-12 18:10:24,11 subtle signs you might have #SeasonalAffectiveDisorder : https://www. bustle.com/articles/19272 0-11-subtle-signs-you-might-have-seasonal-affective-disorder … #health #medicine #SAD #SelfHelp
#sad,HeyTammyBruce,2016-11-11 21:55:01,But he settled for a beach house. #sad https:// twitter.com/memeorandum/st atus/797195025444642816 …
#sad,janenewland,2016-11-11 19:58:07,"A #morrocanblue #horse with a #longface for #colour_collective . The horse isn't really #sad , I just did a bad drawing! Happy weekend y'all! pic.twitter.com/4SmyZS70U1"
#sad,scientistjadams,2016-11-10 16:14:10,It's astonishing that #Trump supporters have zero empathy or perspective about this. ALL their tweets are so hateful. #ThursdayThoughts #sad
#sad,stoolpresidente,2016-11-10 14:39:51,Extra space seats board before military on JetBlue? #sad . I have extra space but waited to board out of principle
#sad,myabysslife,2016-11-10 08:28:10,"said ""grab them by the pussy"" about women and people vote him into office.....how are you? What are you? Like what??? #sad"
#sad,iansomerhalder,2016-11-10 01:34:18,"I 2nd that, your misguided vote for a for 3rd party gave Trump the election.I'm sure you meant well but you changed history forever. #sad https:// twitter.com/paulwesley/sta tus/796325473781477376 …"
#sad,bad_bad_bernie,2016-11-09 23:53:36,"Hillary ran a nasty campaign, while accusing the nicest man in politics of being the negative one. #Sad https://www. wikileaks.org/podesta-emails /emailid/59128 … #PodestaX pic.twitter.com/Jm6jTm8LFY"
#sad,LdyGuin,2016-11-09 19:30:14,Our teen daughter bullied on social media for supporting Trump #Sad Proud of her for standing up for what she believes!! #myvote2016 #MAGA pic.twitter.com/sBOpgMg5jg
#sad,SuzyHazelwood,2016-11-09 16:12:07,There's a time for a brave face and a time to not conceal the sad it's okay to not feel okay #micropoetry #okay #sad #poetry #depression
#sad,KETCHUPnim,2016-11-09 15:46:22,️ ️ ️ #TT #Sana #사나 #湊崎 #紗夏 #さな #TWICE #트와이스 #sad #GIF pic.twitter.com/xWOOufsqWF
#sad,Lucasfilms1999,2016-11-09 14:30:25,I can't believe some people ARE NOT standing for the Pledge of Allegiance today. We say that pledge to honor America and our Fallen #sad
#sad,AbdelaHA06,2016-11-09 12:31:59,Hoy ha ganado el racismo Hoy ha ganado la homogobia Hoy ha ganado la islamofobia Hoy ha ganado el Machismo i am #sad #Trump
#sad,EmmyMakeUpPro,2016-11-09 10:14:58,Irréel... #sad
#sad,legwarmrs,2016-11-09 09:22:14,I needa blunt rn but I don't have a blunt rn #sad
#sad,KusakaveDE,2016-11-09 08:36:13,Bin dafür den Tag des knuddeln auf heute zu verlegen.. Ich könnte grade eine riesige ladung gebrauchen ;-; #sad
#sad,Pre3tty1,2016-11-09 08:06:15,i swear this election showed how many people care more about money than humanity. #ElectionDay #HesNotMyPresident #whatajoke #sad
#sad,HaroldPerrineau,2016-11-09 07:59:16,Tried to sleep through this but couldn't. What do I tell my girls now? What kind of country do we live in? #sad #stunned
#sad,CurtisParadis,2016-11-09 06:44:11,"America was not ready for the first Female President. Instead they went with a Racist, Sexist, Bigot. #sad"
#sad,prokletniklfc,2016-11-09 06:39:36,"Karma je kad Srbiji namestiš Tomu Nikolića, a onda tvoj narod izglasa sopstvenog Tomu Nikolića! #SAD"
#sad,Barnacules,2016-11-09 06:20:29,If you think I somehow support @HillaryClinton because I don't support @realDonaldTrump you would be mistaken. They both are pure evil! #Sad pic.twitter.com/GBPotf5qNH
#sad,Andre_Hamann,2016-11-09 06:01:53,America ...... don't know what to say!!!! #sad
#sad,mkulltra,2016-11-09 05:52:54,"No matter what happens tonight, my heart is broken at the thought of there being so many hateful, ignorant ppl in my America. #sad"
#sad,jennylsq,2016-11-09 05:43:51,Wish I could call in #sad to work tomorrow...
#sad,DhaSickest,2016-11-09 05:18:13,Y'all need to seriously do your own research rather than going off what you see and then tweet it just to get retweets and favorites. #sad
#sad,QueenLesli,2016-11-09 05:01:31,"We'll still . We'll still fight hate. We'll rise above. We'll keep going. Most importantly, we'll NEVER let you grab us by the pussy. #sad"
#sad,LickTheCake,2016-11-09 04:47:18,Im embarrassed to be an American right now. #sad
#sad,RedDogT3,2016-11-09 04:40:03,This happening because of Career Politicians. America is fed up with a system that works for Washington and not the people. #sad
#sad,balleralert,2016-11-09 04:01:56,This shows the America we live in... #sad
#sad,nikel18,2016-11-09 03:42:47,Woman just said she voted for trump because he tells it like it is. Disrespecting women is not telling it like it is. Women allow this #Sad
#sad,padresalvajee,2016-11-09 03:04:53,Ojala que gane Donald Trump a ver si devuelven a mi papa y responde por mi :( #sad #ElectionNight
#sad,grantnewsomeiv,2016-11-09 02:40:17,"Don't forget that some are watching their TV's fearing for their lives & their rights, while the others are fearful of a woman in power #sad"
#sad,GusGusgrei,2016-11-09 02:39:39,"Leider erinnernt mich die ""Punkteverteilung"" an ""Schlag den Raab"" - und am Ende gewinnt der, der am meisten pöbelt... #USwahl16 #sad"
#sad,planetmonster,2016-11-09 02:29:09,Uneducated voting against education. Workers voting for a man who won't pay them. Women voting for a serial sexual predator. #AmeriKKKa #sad
#sad,AnaPalacio496,2016-11-09 02:21:08,Los resultados de las elecciones de USA son un reflejo de que tan mal esta el mundo en el que vivimos #sad #ElectionNight
#sad,NilesGregory,2016-11-09 01:35:34,I haven't seen limon chips in weeks. #sad
#sad,angelina_maldo,2016-11-09 00:37:35,Today's my last time ever driving to masters college for soccer practice since the start in 5th grade #sad
#sad,Maree71439592,2016-11-09 00:37:20,(EBONY) #Sad #Senior #Beauty Owner Sick TBD 11/9/16 Adopt/Foster/Pledge Killing at12PM http:// nyccats.urgentpodr.org/ebony-a1095963 pic.twitter.com/gdHMsHsJkh
#sad,maritschulte,2016-11-09 00:34:55,Sad to see Trump wins states... How can people still think he is better than her. #sad #ElectionNight
#sad,mirandaarceana,2016-11-08 23:57:19,Todos tan: tengo una relación de un año y yo tan: en este año nadie me ha gustado #sad
#sad,Dacidbro,2016-11-08 23:51:03,"Man I can't believe Obama dies tomorrow, as all presidents do after sacrificing themselves to the 8 years of presidency #sad #electionday"
#sad,UK__David,2016-11-08 23:20:33,"If this election has done anything, it has exposed how divided our country is & how quick to hatred we are over a differing opinion. #sad"
#sad,LoganRodgers111,2016-11-08 23:15:54,I've seen a lot of Christians more outspoken about their political thoughts than I've ever seen them share about Jesus. #sad #electionnight
#sad,ManWhoSkips,2016-11-08 20:57:37,Hillary supports Hillary NOT women! #WTFAmericaIn5Words #sad #IVOTED #IVotedTrump #MAGA3X #MAGA
#sad,azmoderate,2016-11-08 20:52:46,As this day progresses we see @realDonaldTrump losing what few marbles he had left #SAD #electionday
#sad,YanaBoss01,2016-11-08 20:24:13,I'm so tired . I want sleep and drink #folloandlike #likeforfolow #folloback #StrangerThings #sad #top
#sad,EinDaw,2016-11-08 20:15:34,@SatansKind__ d1 Seele ist auch leer #deep #sad #
#sad,blaketopia,2016-11-08 17:21:22,It just really hit me. Tonight HALF of the country will be frustrated and upset. That is not o.k. #Election2016 #sad #COMETOGETHER
#sad,wimmy_jeber,2016-11-08 16:52:38,Hmmmm but trump said some mean things so there is no way he should be president :( #sad #liberaltears https:// twitter.com/montanna_paige e/status/795730321060794368 …
#sad,4lisaguerrero,2016-11-08 16:44:49,Hope he's not feeling deflated. #Sad ! https:// twitter.com/usatodaysports /status/796029572219338752 …
#sad,rivyoung2301,2016-11-08 16:44:31,The thought that Trump or Clinton could be POTUS is a disgrace to this country. #BOTHTRASH #WhatHaveWeComeTo #Sad
#sad,polskathetimes,2016-11-08 16:17:46,"Komunistyczni zbrodniarze zostaną osądzeni. Powstaje Społeczny Trybunał Narodowy http://www. polskatimes.pl/aktualnosci/a/ komunistyczni-zbrodniarze-zostana-osadzeni-powstaje-spoleczny-trybunal-narodowy,11437350/ … @DobreImiePolski #Historia #Sąd pic.twitter.com/Pghi8rFcxX"
#sad,liddsg,2016-11-08 15:44:38,Hace: frío Quiero: mimos Tengo: nada #sad
#sad,stoolpresidente,2016-11-08 15:31:34,"Media bias summed up in the entire Trump/Brady/Belichick fiasco. Trump's a liar, blah, blah, blah. Confirmed he told the dead truth. #sad"
#sad,veronica0909,2016-11-08 15:00:54,"Gane quién gane, es una pérdida para el mundo, la genocida psicópata o el sátiro misógino. #sad #ww3 #Mundoendecadencia"
#sad,Sky1876Online,2016-11-08 14:24:00,Women Reveal What Drove Them To Cheat On Their Husbands http:// wp.me/p4KqYB-4ij #cheat #wife #woman #husband #love #sex #relationship #sad pic.twitter.com/OfZHU7SREb
#sad,satanicx_,2016-11-08 14:20:35,No puedo hablar con alguien sin pensar que estoy molestando #sad
#sad,Funny_Leone,2016-11-08 14:20:19,"That Iguana - snake video symbolises the struggle, most of Indian women go through when they step out of the house till they come back. #Sad"
#sad,trishagryd,2016-11-08 13:15:20,the fact na tuesday pa lang :-( #sad
#sad,_Pantzke,2016-11-08 13:08:32,"It's days like these I'm honestly bummed I'm from a bleeding liberal state like Minnesota.... #sad Regardless, go VOTE!"
#sad,OLegendStudios,2016-11-08 12:47:02,I've NEVER seen more anger & aggression come out of people when defending #Trump . Disrespect & rudeness is at an all time high. #sad #scary
#sad,danielthree18,2016-11-08 12:38:52,"All these ""Christians"" crying and vomiting over their voting choices just reveals where their hope lies...and it's not in Christ!! #sad"
#sad,Martin_Sellner,2016-11-08 11:50:55,In jeder Synthwaves schwingt bereits die Trauer über den Untergang einer Zivilisation mit. #sad
#sad,Gluegames,2016-11-08 11:37:32,glad plug stock photos #sad
#sad,ayaneo_,2016-11-08 11:16:47,. もうジャンパーを着ることも 荷物でいっぱいの鞄を 持つこともないんだなぁ ただたださみしい #sad #sad #sad #lonely http:// ift.tt/2fAARIw pic.twitter.com/Q1mvWoq2Fm
#sad,TVdarrell,2016-11-08 10:10:38,Fizzypop Buddy for an historic repeat victory? @wimbledondogs stages its last ever @WillHillBet Leger @SkyGreyhounds #excited #sad
#sad,19carry81,2016-11-08 09:35:10,The fate can be like a bad snake ...... #fate #sad #pain #Loki pic.twitter.com/mG3WqCjiZc
#sad,HanfordJoy,2016-11-08 09:29:38,"This morning Molly was #sad to leave her pajamas. Me, too. Everyday. #momlife http://www. conversationswithhank.com/2016/11/08/paj amas/ … pic.twitter.com/AdMffJwnxK"
#sad,LegacyOfScars,2016-11-08 09:28:29,"Ok, drei Mädels von der 'Digitale Kunst' Gruppe haben endlich eine #Idee die ich aber nicht sagen darf #sad #CssProjekt"
#sad,JuliaNastase,2016-11-08 09:26:50,"Express feelings, emotions and needs. #happy #sad #sleepy #intrapersonalintelligence @ColegioMirabal pic.twitter.com/P2JokM7y2G"
#sad,E_Kyunechan,2016-11-08 09:26:29,Check out ToppDogg- Rainy Day #ToppDogg #KPOP #comeback #new #music #video #slay #sad #lovesong #deep #slay #nowplaying #FirstStreet #POP pic.twitter.com/y9J85YjgOk
#sad,DalijaAJB,2016-11-08 09:24:04,"Price iz #USA od 12 do 22, spec. #AmerickiIzbori2016 program od ponoci do zore.Reporteri @AJBalkans uzivo iz #SAD https://www. youtube.com/watch?v=eD4huK cYOnA&sns=em …"
#sad,Vimalcalculator,2016-11-08 09:23:20,Some of my dear #Adian are mocking me ... in other words they are making me to abuse My @ajaydevgn sir #Sad !!
#sad,DTrumpFan,2016-11-08 09:22:20,rosie o'donnell? more like rosie o'feebleminded #TrumpTrain ? #teaparty #Sad #crazytrump ?
#sad,JonnyTiersten,2016-11-08 09:21:27,I just read a NYtimes article where the writer used the term 'relatively quickly'. You cannot use an adverb to modify an adverb. #sad
#sad,dee_es_kay,2016-11-08 09:19:25,Happy birthday #SAD Hope you had a memorable day (and night)! Thanks for all the cake @suzdavis18 pic.twitter.com/Gb5IN2vQi3
#sad,torridtext,2016-11-08 09:16:20,"Remind me to stay out of Millsfield, N.H., where Trump beat Clinton by a margin of 4 to 1. What a disaster. #Sad"
#sad,MayCharlier,2016-11-08 09:05:56,"Brexit, Marks & Spencer leaving Brussels. UK seems more and more far away from me. #sad #brexit #MarksAndSpencer"
#sad,trueNija,2016-11-08 09:05:44,"While Government is cutting cost and increasing revenue generation, Gombe State Governor despite the recession have over 100 aids. #Sad"
#sad,exmarkstheryan,2016-11-08 09:04:54,My hayfever is so bad I want to scrape out my insides with a knife #Sad
#sad,huva6,2016-11-08 09:04:38,"In a non related news, when gays cry for representation, some only care for their ship to be canon with disregard to other tv lgbts. #sad"
#sad,agustincoorrea,2016-11-08 08:42:02,Tengo que hacer muchísimas cosas hoy. #sad
#sad,saga_dear,2016-11-08 08:38:00,Wij hebben pgb/zin/zzp/etc maar in Amerika moet je t doen met dr. Phil. #sad
#sad,isabelgagarin,2016-11-08 08:37:48,"And suddenly, biglang matalino ang mga tao sa social media....pero mapanghusga pa rin. #sad"
#sad,tacticsbird,2016-11-08 08:35:53,I got up in the dark and I know I will go home in the dark. I need one of those #SAD lamps
#sad,Jester454,2016-11-08 08:31:25,Smh... What a day to be alive... #Sad #ClownShow
#sad,tbear1206,2016-11-08 08:23:18,I absolutely hate when my ears hurt... and my ear hurts #sad #pain
#sad,PikarskaMafia,2016-11-08 08:13:28,Dziś koniec procesu Jerzego E. juniora? #Radomiak #RadomiakRadom #Radom #korupcja #sport #PZPN #futbol #proces #sąd http:// pilkarskamafia.blogspot.com/2016/11/dzis-k oniec-procesu-jerzego-e-juniora.html …
#sad,DTrumpFan,2016-11-08 07:42:20,Leave Donald Trump alone! #teaparty #DonaldDump #Sad #stylishtrump ?
#sad,helpmeimamedic,2016-11-08 07:40:12,This is how #sunlight affects you mental health http:// ti.me/2eFswWf via @TIMEHealth #mentalhealth #sad #seasonalaffecteddisorder #health pic.twitter.com/t7btDl0MjI
#sad,VeniceForHRC,2016-11-08 07:35:26,He can't get Hollywood to support him so he will just mimic lines from movies #sad & #funny at the same time. https:// twitter.com/latinaafortrum p/status/795868016194027520 …
#sad,RefSRK18,2016-11-08 06:59:44,A Baby needs the care of his parents & If his his parents don't accept & love him then no one will do. #justsaying #Raees #Orphan #Sad
#sad,SadPianoMusic,2016-11-08 06:58:28,"Now playing : Alexandre Desplat - "" River Waltz (piano solo)"" on http://www. sadpianomusic.com / #sadmusic #sadsong #sad"
#ifeelsad,Zinnia_LoGar,2016-11-12 01:45:29,#Young #Ifeelsad pic.twitter.com/F2lsBVIIhe
#ifeelsad,bananafryandtea,2016-11-11 05:34:25,Some things will never happen again. Like going to that holiday destination again. Or fitting into those jeans from 5 years ago. #ifeelsad
