#fatigued,SheetMaskLady,2016-11-11 07:58:37,"I want to mask so bad to relax, but it won't help keep me awake during work #fatigued"
#fatigued,michaelei,2016-11-09 07:35:30,Anytime Fitness office visit conducting Functional 50 class ftw!! #health #fitness #fatigued … https://www. instagram.com/p/BMlMqL2jdim/
#fatigued,SimplySaharaC,2016-11-09 05:30:16,#fatigued
#fatigued,_ronicaax,2016-11-09 05:29:26,#sleepy #tired #slump #fatigued #weary #exhausted #notsurprised #america < #synonyms #gn
#fatigued,N_fries,2016-11-08 23:41:26,"Kentucky? More like Trump, Yucky! #sad #lonely #fatigued #umelectionparty"
#gloomy,breezeleez,2016-11-16 23:19:24,My feelings matches the weather. #gloomy
#gloomy,TheKatieWalder,2016-11-16 00:47:18,"It's 4:46pm, but why does it feel like it's 8:46pm??? #Gloomy"
#gloomy,itsMazzola,2016-11-15 20:26:27,AM X @ArianaGrande feat @1future - Everyday #ArianaGrande #future #everyday #scooterbraun #gloomy #trap #chill #edm http:// bit.ly/2fVgZn1
#gloomy,TurkeyBowlNews,2016-11-15 17:49:39,Today is #gloomy but it will be a beautiful day for football Nov. 24 when the #TurkeyBowl kicks off. pic.twitter.com/sA5Tn51hbX
#gloomy,pipay74612493,2016-11-15 09:50:33,#gloomy morning #scelgo toroncini sweet tuesday pic.twitter.com/4qjoOUo43h
#gloomy,Teperz,2016-11-14 10:54:57,"Why does a season swallow up my ability to be happy? Why is it dark, cold, rainy nights paint an accurate picture of how I feel? #gloomy"
#gloomy,violetfenn,2016-11-13 10:44:16,I’m putting together a ‘Xmas gift guide for the Goth in your life’ - anyone got good ideas for darklings?? #goth #gloomy #Christmas
#gloomy,yaboychizzy,2016-11-12 23:01:45,"Egg nog, Honey Jack & making beats kind of day #Gloomy"
#gloomy,yungremorse,2016-11-12 21:04:04,Me and @c_Breedlove havin' lunch and discussing the future of the #gloomy collective.
#gloomy,Marchhaart,2016-11-12 10:35:18,"Have a read of our #Inspiration blog to cheer up a #gloomy , #rainy , Saturday! https://www. haart.co.uk/inspiration/ #beinspired #haart #ideas"
#gloomy,5_carolinebrown,2016-11-12 03:55:17,#AUSvRSA . Is this the first time in test history that the lights have been on all day on day one. @BlundstoneArena #gloomy
#gloomy,MusicWeeklies,2016-11-11 19:30:39,"Thanks everyone! Check out all the #gloomy entries here: https:// musicweeklies.com/2016/11/04/mw- 19-11416-111116/ … , or here on SoundCloud: https:// soundcloud.com/musicweeklies/ sets/mw-19-11-4-16-11-11-16 …"
#gloomy,qwercus_,2016-11-11 18:41:53,My #gloomy entry for this week's @MusicWeeklies https:// soundcloud.com/qwercus/pensive
#gloomy,MusicWeeklies,2016-11-10 20:01:56,1 day left to get in your #gloomy entries for this week’s MW! New theme for tomorrow’s Raffle at 12:00 pm PST. Spread the word!
#gloomy,leahroseFTW,2016-11-10 17:21:34,The most ridiculous sunnies in the world second only to shutter shades #pointless #gloomy … https://www. instagram.com/p/BMo0f0rhcBt/ pic.twitter.com/Yq7INXXJXe
#gloomy,Violet_Adia,2016-11-10 05:28:04,Okay. Going to try playing #thedetail #crime #gloomy #twitch @girlstreamers @TwitchSharer #gaming http:// Twitch.tv/violetadia #newgame
#gloomy,JaiManny,2016-11-09 23:11:12,After the storm.... #nyc #clouds #rain #cloudy #downpour #gloomy #igers #instagood #skyscr … https://www. instagram.com/p/BMm3uKbg4Yc/ pic.twitter.com/jr4n94FUnD
#gloomy,Strawbry29,2016-11-09 21:16:18,I can't even wear my sunglasses because the sun didn't shine today! Mother Nature knows how we feel #gloomy
#gloomy,MusicWeeklies,2016-11-09 20:01:18,2 days left to finish your #gloomy entries for this week’s MusicWeeklies! New theme and raffle on Friday 12:00 pm PST!
#gloomy,cbdgarnish,2016-11-09 19:51:11,A little brightness on a #gloomy day in #Philly . #thedayafter #weddingWednesday pic.twitter.com/07eNyvVENY
#gloomy,lantz5150,2016-11-09 19:15:44,This weather #Cleveland #Weather #cold #gloomy
#gloomy,Lindsay_Senter,2016-11-09 18:01:49,"It's a #cold , #dark , and #gloomy day. How appropriate."
#gloomy,SCfloraldesign,2016-11-09 17:18:02,Birmingham in November #November8 #cold #gloomy pic.twitter.com/BhyuZsUH4e
#gloomy,MeggsRedd,2016-11-09 16:07:19,The weather today is a good representation of how this election ended @realDonaldTrump #gloomy
#gloomy,TJsDesignsEvent,2016-11-09 16:07:11,#WOW Wednesday! Here's a little #inspiration to get you through this #gloomy morning. #TJsFancies #CHICspiration #OrlandoWeddingPlanner pic.twitter.com/SZtibDTTNO
#gloomy,magicb77,2016-11-09 15:09:00,What's with the weather today? #clouds #weather #gloomy #skyscape #cityscape #cluj #instamood https://www. instagram.com/p/BMmAjoqhQu7/
#gloomy,ongatl,2016-11-09 15:00:46,#NewYorkCity is #gloomy after last night. #USElections2016 @The GEM… https://www. instagram.com/p/BMl_nbqAx1bV v7XCjMOzAWTDXoSeL1WIjdkEhU0/ …
#gloomy,EducatedNPetty,2016-11-09 14:32:56,This NY weather matches my mood right now: #gloomy
#gloomy,HealthyTF,2016-11-09 12:05:16,Its easy to feel #gloomy when we get up & come home in the #cold & #dark . But what if its something more? http:// ow.ly/jiom305XZco
#gloomy,nurulelani,2016-11-09 09:26:34,his favorite spot #cat #lemon #tingkap #gloomy #evening #instashot #igersmalaysia #filter #vsco … https://www. instagram.com/p/BMlZXeQh-NK/
#gloomy,HattyBeth,2016-11-09 09:10:44,From gloomy skies to white out they both look pretty #weather #snow #sky #gloomy #stormy … https://www. instagram.com/p/BMlXjm-jAMC/
#gloomy,Thisistracybean,2016-11-09 07:44:57,"Well you Americans you really have surpassed yourself, what a dark day in U.S politics #gloomy"
#gloomy,JAMgirl_Iva,2016-11-09 02:58:12,#Florida hasGoneRather #gloomy indeed-Outlook #dreary #depressing ~butMaybe TheWeatherChanges #UK Style #Election2016 pic.twitter.com/nkazCNuYpp
#gloomy,dashedragon,2016-11-08 23:35:18,My #gloomy @MusicWeeklies entry for this week! https:// soundcloud.com/seventh-beast/ the-way-forwards-is-backwards …
#gloomy,jarrousnation24,2016-11-08 23:15:46,Beautiful fall day outside #Fall #Dark #Gloomy #Rain
#gloomy,rowanmoreno,2016-11-08 22:30:57,5:30pm looks like 10:30pm. #gloomy
#gloomy,neroscartch,2016-11-08 21:54:15,"On the way to rehearsal. Actally, it's getting pretty good #NSLive #winter #gloomy pic.twitter.com/G4wKlwTWZu"
#gloomy,kelseeday,2016-11-08 21:45:35,This weather very accurately describes my feelings of the election. #gloomy #ElectionDay
#gloomy,BingOh32,2016-11-08 21:30:00,The weather sums up how people feel about the election #gloomy
#gloomy,bnbindy,2016-11-08 21:03:33,"These 3 are hard at work to brighten up this #gloomy day. If you haven't met Jonathan, Dennie or… https://www. instagram.com/p/BMkEVLfhwQm/"
#gloomy,_Tristanner,2016-11-08 21:02:28,#gloomy
#gloomy,kateykat19,2016-11-08 20:15:59,Feeling dark today so to the gloom... I LOVE it lol #darkday #gloomy #darkmakeup #selfie #crazyhair pic.twitter.com/NdBYOZ2CrV
#gloomy,PepeYacaman,2016-11-08 19:00:50,It's #gloomy on the other side... #ElectionDay @Juárez–Lincoln International Bridge https://www. instagram.com/p/BMj2S1yjYRv/
#gloomy,NigroCarm,2016-11-08 18:57:33,a #rayoflight always make you #wish though if with a #gloomy #sky #skyporn #colous #sunset … https://www. instagram.com/p/BMj16r3jpU0/
#gloomy,agk4444,2016-11-08 17:24:08,"#Gloomy #scenario at #COP22 : #2015 #warmest #year , #trend to #continue https://www. socialnews.xyz/2016/11/08/glo omy-scenario-at-cop22-2015-warmest-year-trend-to-continue/ … pic.twitter.com/Ryd7mi4RV0"
#gloomy,Paola_xyz,2016-11-08 16:33:55,#righthererightnow #frommywindow #clouds #gloomy #huaweip9 #leicalenses #leica #colours … https://www. instagram.com/p/BMjletdj6Kb/
#gloomy,bangbangtooth,2016-11-08 15:52:41,"melihat kelangit, dan kehati. #building #jakarta #gloomy #vscocam #vscogood @Royal Mediterania… https://www. instagram.com/p/BMjgwsYjDSS/"
#gloomy,baileydent_,2016-11-08 15:10:50,I hope this weather isn't a reflection of the results of this election... #gloomy #ElectionDay
#gloomy,stivenpatras,2016-11-08 13:00:50,blue for a gloomy tuesday #ootd #blue #black #sneaker #sneakers #rainyday #gloomy #feelblue https://www. instagram.com/p/BMjNGFmA_rb/
#gloomy,wddty,2016-11-08 12:00:03,It’s the length of the #day —and not #gloomy #weather —that makes us feel down #SAD #WDDTY #Winter #Seasons #emotions http:// bit.ly/2fvMS3A pic.twitter.com/6XPsVisUbQ
#nothappy,katieyourock,2016-11-15 17:11:36,Every year they take @imacelebrity of telly for football!! don't you men have enough bloody sports channels!! Pfft ! #nothappy
#nothappy,DerekStoy,2016-11-15 17:09:20,"For the 39th consecutive year I was not named ""Sexiest Man Alive."" #NotHappy"
#nothappy,Shiny_Steve,2016-11-15 13:47:21,"How can we be expected to mix it with Germany, Spain, Italy etc if we can't even hold out Thailand? #THAvAUS #NotHappy"
#nothappy,Food4U2like,2016-11-15 11:33:58,If Donald Trump was allowed to run for president why wasn't Sylvester The Putty Cat #NotHappy Both of same character #ImStruggling
#nothappy,Mieze90,2016-11-15 09:48:45,Warum träume ich nur immer wieder von Dir?!.. #nothappy #tired #badmemories #mh https://www. instagram.com/p/BM04rSNBM-s/
#nothappy,JulieDeighton1,2016-11-15 09:37:18,When you get told they've put the bloody football on tonight instead of #ImACeleb #NotHappy pic.twitter.com/4CJXmEsw8C
#nothappy,MariaBiruela,2016-11-15 05:40:17,Thank you #Manila for this tribute to #Ireland in my day off #NotHappy pic.twitter.com/CzWL8g0enS
#nothappy,FlaviaATW,2016-11-14 19:25:54,"Liebe @blau_presse wo stehe Ihre Email Adresse? Ich finde seeeehr kompliziert, mit Ihnen zu kontaktieren :-( #nothappy"
#nothappy,bradsspancakes,2016-11-14 08:58:06,Okay... it's raining so much and I've got to walk to the train station and then when I'm off the train walk to college #nothappy
#nothappy,meatonnn,2016-11-14 08:49:28,pt5 @BuzzFeed it is a very REAL fear and is not something u can just casually post about without ANY warning. #removethepost #nothappy
#nothappy,lipglossncod,2016-11-14 00:36:34,Haven't smoked a cigarette in 2 friggen days. I might rip someone's head off! #mood #NotHappy
#nothappy,elff73,2016-11-13 06:55:29,WTF... this is the #weekend I should be #sleeping .... instead been awake for hours again #nothappy #tired pic.twitter.com/RGzpt8ikpV
#nothappy,allison_mechela,2016-11-13 02:13:00,MY MOM TOOK MY DOG AND CAT TO @tacobell AND @sonicdrivein FOR TACOS AND ICE CREAM BUT LEFT ME AT HOME #nothappy
#nothappy,brittcudzilo,2016-11-12 20:30:40,#nocableprobs : The watch ESPN app decided to stop playing the #UKvsTenn game end of 3rd quarter... Missing the game. #nothappy #butcheap
#nothappy,jjs999jjs,2016-11-09 22:18:50,GRRRRRRRRRRRRRRRRRRRRRRRRRRRRRR #nothappy https:// twitter.com/scottishfirst/ status/796476998336057344 …
#nothappy,LionGuardBunga,2016-11-09 21:21:45,LIVE REACTION: Simba finds out that Donald Trump is the new president. #NotHappy pic.twitter.com/n9xZKzXDpb
#nothappy,whijess03,2016-11-09 14:47:13,Woke up with a headache. God I hope he picks a good cabinet & does right by us. #nothappy #scared
#nothappy,yeah_royyy,2016-11-09 14:03:24,AS IF they've got ANOTHER news special on @BBCWorld about the election...I am now missing @BBCDoctors today? Fml. #NotHappy
#nothappy,jesskeily,2016-11-09 08:00:13,Trump's son is expressing my own feelings perfectly #nothappy #ElectionNight #trump pic.twitter.com/rNU4dtGxcu
#nothappy,laurenthigpen23,2016-11-09 04:24:24,Love how barely any students have a say in the superintendent!!! #nothappy
#nothappy,JourneyWithZena,2016-11-09 03:40:10,The emails are killing Hillary's white vote. But black people didn't vote at all because of Bill's mass incarceration laws. #nothappy
#nothappy,bdiva80,2016-11-09 02:15:12,If this country elects @realDonaldTrump we deserve whatever bad things happen along the way :( #nothappy
#nothappy,JNY93,2016-11-08 23:45:37,"#vote #usa #peace hoping next time, when my kid is eligble, there will be better choices. #ElectionDay #nothappy #ivomited #ivoted pic.twitter.com/jQSZYk17NO"
#nothappy,emilyvnaylor,2016-11-08 23:45:21,Spyro's been loading for a while now and I'm starting to think CEX gave me a dodgy disc #nothappy
#nothappy,deweyandbugsmom,2016-11-08 23:36:03,"Stuck at an @Airbnb rental with a ""42"" tv with Netflix"". What they failed to mention was that Netflix was ALL the tv gets. #nothappy"
#nothappy,spmoran11,2016-11-08 23:27:48,Hey @GEICO how's your renters insurance? Been dealing with @USAA for 2 mth on a claim and can't get a status update. #nothappy #timetoswitch
#nothappy,Hebsharpe,2016-11-08 22:32:44,To the person who stole my favourite sports socks from the changing room today: I wish you cold feet forever. #ColdFeet #nothappy
#nothappy,Mazfaz,2016-11-08 21:49:11,Tickets not delivered for Austria v Ireland match. @UPS need @viagogo to raise a query.Please contact me @viagogo #urgent #nothappy #tickets
#nothappy,cazthesarrie,2016-11-08 20:58:48,Why cant eddie jones see that goode is the best 15 what does he have to do #nothappy
#nothappy,Dangelik,2016-11-08 20:02:57,"I just love to be scolded like a child, it's just one of my favourite things in the world #not #nothappy"
#nothappy,GOPAmericanMom,2016-11-08 19:10:25,My daughter's college is NOT offering voting for students! Now she has to drive home after classes to vote before 7:30 pm #Nothappy
#nothappy,lorelaybove,2016-11-08 19:01:24,MOTHER EARTH #ctn #ctnexpo2016 #ctnx #painting #original #art #bootht103 #motherearth #nothappy … https://www. instagram.com/p/BMj2W0ih9sy/
#nothappy,StJohnsWindows,2016-11-08 18:53:05,"Just got my first order confirmation with ""Currency Surcharge on"" #NotHappy"
#nothappy,FPL_Fly,2016-11-08 17:04:42,This Sanchez injury is awful news and playing right into the hands of #FPL managers who need an easy way to get Hazard. #nothappy
#nothappy,omgitschasta,2016-11-08 16:41:23,I bought a balloon on lunch. Dora the explorer. Super classy. Then it flew out my car window. #gofigure #happytuesday #myluck #nothappy
#nothappy,real_adr0510,2016-11-08 14:09:58,Hey @SamsungMobileUS whats the difference between s7 edge and note 7 cause this s7 no edge i got is garbage #nothappy
#nothappy,terr6210,2016-11-08 14:04:19,"Good Morn all..Okay America,lets do this today&hope&pray we can get through the next 4 years with whoever sits in that chair. #Vote #NotHappy pic.twitter.com/iyvhNQHWDu"
#nothappy,Linda_Keetley,2016-11-08 13:49:23,Shopping with Dad. He gets everything he needs and the 2 things I went for they didn't have !!! #maybenexttime #nothappy
#nothappy,emilyduncan88,2016-11-08 13:35:13,be careful when signing up to @Namesco my bf got stung with a 20% refund policy when purchasing package in error #nothappy
#nothappy,barbie0022,2016-11-08 11:46:52,So the 1st time I use @PostandPacking and my parcel goes missing #nothappy
#nothappy,gageykev,2016-11-08 11:36:18,"Forget Brexit, USA elections, etc.... What the fuck have they done to a Toblerone? Bigger gaps, less chocolate! DISGRACEFUL! #nothappy pic.twitter.com/2RUYGNoXUl"
#nothappy,pqlenator,2016-11-08 10:15:04,Australian tourism officials furious over slogan 'See You in the NT' http:// dailym.ai/2fza1k1 via @MailOnline #CUintheNT #australia #nothappy
#nothappy,SaraHoney340,2016-11-08 10:13:19,#Toblerone #jumping #nothappy #badnews
#nothappy,ZafYusaf,2016-11-08 10:12:53,Me & 3 family members really letdown by @VodafoneUKhelp Really bad service. We never get signal anywhere. We don't live in a cave! #nothappy
#nothappy,Fabulous_minx,2016-11-08 10:11:40,When all you want is to continue with your dreams and hopes for the future but your health is putting them on hold. #nothappy
#nothappy,daisyrainbow_,2016-11-08 09:48:02,The walking dead is kinda disappointing at the moment:/ #nothappy
#nothappy,ailish_wall,2016-11-08 09:26:09,They've changed the shape of Toblerones (via @thejournal_ie ) http:// jrnl.ie/3069348 crisis in my house #nothappy #Toblerone
#nothappy,FriendsMeh,2016-11-08 09:09:10,#nothappy vanilla ice cream is on the menu 2 nights got none. #affogatoneedsicecream
#nothappy,JanJordan64,2016-11-08 09:02:53,Two hours to get from Bicester to Oxford!!!!!!!! #nothappy #freezing
#nothappy,vintage_barbie1,2016-11-08 08:59:01,Yep - aired early without warning #nothappy @TheBlock https:// twitter.com/jono_nelse06/s tatus/795909908310806528 …
#nothappy,MetalMick13,2016-11-08 08:39:25,It absolutely boils my piss that students get @Spotify for half the price I do. I'm cancelling it. #NotHappy #PrayForMick
#nothappy,JudithTaylor_,2016-11-08 08:39:11,Woke up with a gastric pain and bloated belly is no fun at all. But I don't think I ate something funny last night like. #why #nothappy
#nothappy,kerryleeanne,2016-11-08 08:03:11,Digi box missed 2 recordings! #nothappy
#unhappy,Smatthew1065,2016-11-16 23:41:18,Detox begins now #detox #unhappy
#unhappy,DGTheLifeCoach,2016-11-16 22:39:46,TIP: How you feel really matters! #Unhappy ? Life will be a #struggle . #Happiness is always available to you - it's inside you. #mindfulness
#unhappy,soniaveck,2016-11-16 18:47:11,Im really heartbroken since 3 wks and I don't know how to deal with it. Im just feeling used and played off. #Heartache #loveaffair #unhappy
#unhappy,inkcl1,2016-11-16 10:46:22,เมื่อไหร่จะผ่านไปเสียที #unhappy
#unhappy,jacktaylor1198,2016-11-16 08:15:00,Was gunna take the drone up today but the weather decided to take a turn #dji #drone #weather #unhappy
#unhappy,MaggieBain_,2016-11-15 14:52:22,5 Reasons #People Stay in #Unhappy #Relationships http:// sco.lt/8x8taD pic.twitter.com/hUJhMoE8ca
#unhappy,BlakeDiver,2016-11-15 13:42:03,Feeling really really ill need this to pass have so much I have to do before I go away #unhappy face
#unhappy,FBshuvo,2016-11-15 10:39:00,কোথাও যেতে ইচ্ছে করছে! কিন্তু যাবো কোথায় এইটা ভাবতে ভাবতেই দিন প্রায় শেষ! #unhappy #boringlife #tuesdayfeeling :(
#unhappy,sumeetdhagia,2016-11-15 05:36:46,Another #bitterExperience . Rcvd wrong product. #poorservice continued @Snapdeal #Cheater @Snapdeal_Help wht 2 do nw? #disappointed #unHappy
#unhappy,GyanRaj_Kandel,2016-11-15 03:33:45,#Bad_decisions #Bad_times #Unhappy #My_Life
#unhappy,sparklingpurvi,2016-11-13 11:17:18,#wtf #indigo @TH_GoIndigo why would you move my flight to next day and expect me to be ok with it #badservice #unhappy #disappointed
#unhappy,Svucka,2016-11-12 20:36:18,This car is not a happy camper... #Stockholm #Snow #Winter2016 #car #cars #unhappy pic.twitter.com/zusGmnGRa5
#unhappy,sarabeth22515,2016-11-12 18:35:51,Super #unhappy b/c @ricomiccon isn't being fair with how they are filtering people for lines. #ridiculous #GetItTogether
#unhappy,StMihalis,2016-11-12 14:38:13,"Shocking service @SpurRestaurant , very unhappy with the way me and my guests are been treated ... #service #newmarketmall #unhappy"
#unhappy,avril3986,2016-11-11 10:31:18,ちょっと可愛らしい加工 、、 #ポッキーの日 #sharehappi #テストで #unhappy pic.twitter.com/4RR96xRy3G
#unhappy,malprin,2016-11-11 10:12:32,Dear @StarbucksUK Why have you stopped doing skinny blueberry muffins for the xmas period? #Unhappy
#unhappy,wandering_will,2016-11-11 02:00:29,"If I'm ever #unhappy , I find a new #adventure pic.twitter.com/VbLLIj1ECF"
#unhappy,YoungBlingKing1,2016-11-10 19:43:26,"The best remedy for those who are #afraid , or #unhappy is to go #outside , where they can be quiet, #AloneWithTheHeavens , #nature and #God ."
#unhappy,coinabs,2016-11-10 05:36:50,#jstreetdotorg IS VERY #UNHAPPY WITH DONALD #TRUMP VICTORY TOO BAD FOR THEM THEY=> #jstreetdotorg DONT REPRESENT MAJORITY OF #JEWS ! . pic.twitter.com/z5HXTEc7xN
#unhappy,fresh_oil_,2016-11-09 22:18:12,Ummmmmm TBH I'm feeling pretty #bummed #sad #emotions #unhappy
#unhappy,dDdenisa,2016-11-09 20:56:28,I was really really shocked today!!! It was an enormous shock! #unhappy #feminism #Trump pic.twitter.com/Bl9btHGbob
#unhappy,KimFulcher,2016-11-09 20:24:44,Hating life? Why you're unhappy and how to get through it. #unhappy #lifecoach #motivation http:// conta.cc/2fSYTn7 pic.twitter.com/52G0WAj9C3
#unhappy,its_jadex33,2016-11-09 20:02:46,Check out this musical.ly: https://www. musical.ly/v/MzQyNzExNjA5 NzMzNzE1NjY5MDczOTM.html … (made by @its_jadex33 with @musicallyapp ) #unhappy
#unhappy,iamajpaudyal,2016-11-09 17:28:49,There are many people who still hopes that #TrumpedAmerica will change. #ElectionDay #evadable #unhappy #hopeforthebest
#unhappy,jonhagedornmd,2016-11-09 15:33:08,"So many #unhappy people around the #hospital today. Remember, we still live in the greatest country in the #world ! #USA #choosehappiness"
#unhappy,HartleyandParry,2016-11-09 14:15:50,"Thinking of moving to the Mexican border, new 4 year contract has just opened up. #2016election #joke #unhappy #TrumpPresident"
#unhappy,TheAbingdonW8,2016-11-09 12:42:31,Whether you're #happy or #unhappy with the #uselection #results - both are a good reason for having a glass of wine! #ukpub #londonislovinit pic.twitter.com/mqH3Qj8U72
#unhappy,MzPatchouli,2016-11-09 11:50:13,#GOOOOOOOOODMORNING #HAPPY #UNHAPPY #PEOPLE ! pic.twitter.com/q9xov1VZs3
#unhappy,musing_random,2016-11-09 10:21:43,Its safe to say there are a lot of #unhappy people in the world.
#unhappy,Vickiw83,2016-11-09 08:39:55,Seriously @GWRUK @GWRHelp what will it take to get an extra carriage #sardines #seasonticket #unhappy #crosscommuters #dangerous pic.twitter.com/sIcnPj3ZjM
#unhappy,bassking67,2016-11-09 07:08:08,#USADecides #USAelection #DonaldTrump #wtf crazy scenes in america..must be a lot of #unhappy people over the pond
#unhappy,figprayer,2016-11-09 05:46:50,have Money can really be happy ? answer is can not What is the real happiness? share it https://www. figprayer.com/real-love-god. html … #money #happy #unhappy pic.twitter.com/kcCjz2q29r
#unhappy,ViraLety,2016-11-09 05:00:18,Have you been #Scam #Unhappy w. #Saladmaster Saladmaster #MLM #NFB #FollowMe I hate this company #Customerservice
#unhappy,evelyynmarie,2016-11-09 02:10:59,These cramps got to go #unhappy
#unhappy,sheepcow3,2016-11-09 00:37:31,"Shout out to @FedEx for making me pay $5 for 'small filler', is this your new business model? #unhappy #unsatisfied"
#unhappy,LucasHefty,2016-11-08 23:52:58,"Seriously aside from ballots you can absolutely not run out of ""I Voted"" stickers. #Unhappy"
#unhappy,JHayYT,2016-11-08 23:23:23,Wait.. WHAT THE ACTUAL F*CK IS THIS?! OMFG NO! GET LOST! WTF HAVE YOU DONE?! NOT ON! F*CK OFF! F*CK OFF! CHANGE IT BACK! #Toblerone #unhappy pic.twitter.com/96mSCnD5Pc
#unhappy,Shavonthesoul,2016-11-08 22:15:41,School is just going down the toilet and I'm not tryna save it. #unhappy
#unhappy,mercurialbot,2016-11-08 20:32:17,She gets tired of the chronic poor. #unhappy
#unhappy,mercurialbot,2016-11-08 19:02:14,"Instead of anger, I feel only a slight disgust, and a sort of wonder that they are a disappointment to them. #unhappy"
#unhappy,prof_said_what,2016-11-08 18:50:18,"""So if you're #unhappy with 14 kids without any help, you're welcome to take these #tranquilizers ... Mama's little helpers."" #drugs"
#unhappy,jeffcervantez,2016-11-08 17:35:37,#Unhappy with #election result? #Canadians say come over http:// usat.ly/2fzj7yL via @USATODAY
#unhappy,laverde26,2016-11-08 17:32:18,#service #customer #learning #unhappy #source #crm #improve #servicio #cliente #aprender #feliz #mejor #microsoft #billgates #FelizMartes pic.twitter.com/AVKwb2HjnI
#unhappy,LeanneMooreFit,2016-11-08 15:31:46,THEN: #bingeeater #cardiobunny #unhappy and always on a #diet NOW: #Stronger #fitter #happier … https://www. instagram.com/p/BMjcjDkB9yv/
#unhappy,ShaynanRunnels,2016-11-08 15:01:24,#Happy #unhappy #ElectionDay . #Election2016 http://www. shaynanrunnels.dreamtrips.com/refer #vacation #travel pic.twitter.com/tR3ZXCBo60
#unhappy,mercurialbot,2016-11-08 13:32:03,"I gaze at the moment of his achievement unbearable, because he did not refer to a woman. #unhappy"
#unhappy,mercurialbot,2016-11-08 13:02:03,"In his realm there is hatred -- secret hatred: there is vice -- deep, deadly, domestic vice. #unhappy"
#unhappy,donCmontgomery,2016-11-08 12:30:02,Are you guilty of being #grumpy ? Here's ten troubling #habits of #unhappy people http:// bit.ly/2aUY4sj #attitude #badmood #personality
#unhappy,VekaVex,2016-11-08 12:08:46,I'm not living life but just sliding trough.What's meaning of life anyway? #questioningexistance #meaningoflife #unhappy #midifecrises
#unhappy,mercurialbot,2016-11-08 12:02:00,"And what about all the time, may or may not be haunted by Francis's diseased body; that I were imagining it all. #unhappy"
#unhappy,AskDrBurt,2016-11-08 11:24:20,#Happy and #Unhappy heat map of the #human #body pic.twitter.com/nlEmRgFIHs
#suicidal,IALalika,2016-11-16 15:49:46,Sir Lalika deactivating after this laila episode. #Suicidal
#suicidal,MindOurMinds,2016-11-16 10:10:34,#Suicidal patients need better face-to-face support!! #mentalhealth https:// twitter.com/BristolHealthP /status/797090457675251712 …
#suicidal,ItsXelxy,2016-11-16 08:56:44,OMG I need some excitement... I feel weird Just a lil excitement. Is that too much to ask ? #Suicidal
#suicidal,DrJoanCook,2016-11-15 20:16:13,Summary of 50 years on #risk factors 4 #suicidal thoughts & behaviors; Fundamental changes needed in future studies http:// psycnet.apa.org/psycinfo/2016- 54856-001/ …
#suicidal,doccogpsych,2016-11-15 17:03:02,Learn How to Help a Loved One That is #SUICIDAL . http:// bit.ly/1Sgop26 #depression Please Retweet. pic.twitter.com/E3IqtYT08s
#suicidal,DrAPitman,2016-11-15 10:16:41,Prevalence of #suicidal ideation in patients with #cancer estimated at 20-71% http:// onlinelibrary.wiley.com/doi/10.1002/po n.1717/abstract …
#suicidal,demonIoli,2016-11-15 03:29:55,#Suicidal Ass Fuckk Tho <3 ' !
#suicidal,successdriven85,2016-11-14 15:06:46,"I can't believe #Anthony showed up on @FirstTake today Everybody look at his face, when the #Cowboys are mentioned. #Suicidal lol."
