#nervous,SianWeather,2016-11-12 18:12:51,C'mon Cymru! #nervous PS Well done Ingerland & commiserations Scotland pic.twitter.com/6RVX0WufrH
#nervous,SianWeather,2016-11-12 09:40:26,It's another rugby Saturday. Please play better today Wales #nervous #WALvARG pic.twitter.com/bOtsmk5eAZ
#nervous,immtycool,2016-11-12 02:35:01,So I met 2pm and could barely say anything. #nervous #dork #2pm#kpop #melbourne #australia #korea #택연 #찬성 #투피엠 cr.caritocorsal pic.twitter.com/e6WnLeHXi5
#nervous,Mickandu,2016-11-10 15:32:25,"I'm #nervous , driving down this dark narrow road. Being a #horrorfan is not in my favour here. I dare not look in the mirror. #writersblock pic.twitter.com/BRzAXkDNG8"
#nervous,Ayda_Jebat,2016-11-10 13:56:33,Flu. Adik harap tak kecewakan semua AJS esok. Doakan. #nervous
#nervous,Maree71439592,2016-11-10 00:54:32,(MENJI) #Affectionate #Nervous #Boy TBD 11/10/16! Adopt/Foster/Pledge! Killing at12PM http:// nyccats.urgentpodr.org/menji-a1094823 pic.twitter.com/PXP7V92iVy
#nervous,ChiranPatel,2016-11-09 16:53:05,Tomorrow is my first ever shift as a paramedic.. Moral of the story - Never give up and work hard to achieve success #Excited #Nervous
#nervous,wendiwoouk,2016-11-09 04:43:51,Watching the us elections might be in the UK but still feeling #nervous #scared for the worlds future!!
#nervous,GeekyChicky87,2016-11-09 04:29:40,The fact that the Canadian Citizenship and Immigration website has crashed should tell the world something #ElectionNight #nervous
#nervous,Slick_Rick14,2016-11-09 03:59:26,Waiting for election results is like watching an Ole Miss Football game. Anything could happen at any moment #nervous
#nervous,maxitois4real,2016-11-09 03:41:37,"I'm not the only one freaking out right now!! #nervous @East Los Angeles, California https://www. instagram.com/p/BMkx41SFeAc/"
#nervous,JCoopPhoto,2016-11-09 03:22:38,I cannot fathom a reality in which Donald Trump is President of the United States. This cannot happen #nervous #ElectionNight
#nervous,MeganIWilliams,2016-11-09 02:32:04,I'm loving The View's election special on Lifetime. Having a good time through the tv lol #ElectionNight #TheView #Lifetime #nervous
#nervous,laina622,2016-11-09 02:26:25,#nervous pic.twitter.com/dBIC2OktOF
#nervous,BenMcCool,2016-11-09 02:24:35,Tonight's biggest winner? Bartenders. #nervous #ElectionNight
#nervous,JoshNoneYaBiz,2016-11-09 02:18:48,I'm hesitant to tweet much til they call Florida. #Nervous
#nervous,rampalarjun,2016-11-09 01:14:16,Good morning just woke up. Just two days to #rockon2 #nervous #excited #lackofsleep https://www. instagram.com/p/BMkhB54gGRs/
#nervous,MissChristyLMG,2016-11-09 00:23:05,#Urgent #DeathRow #Innocent #Little #Gray #Boy #Kitten #Betty is #Nervous & #Scared @#HighkillShelter #Needs #Rescue 4 his #Life #Brooklyn #NY https:// twitter.com/URGENTPODR/sta tus/796127683570728960 …
#nervous,pejvahdat,2016-11-08 22:23:56,We voted. Get out there and Vote. I love this country. #imwithher #Charlieswithhertoo #nervous … https://www. instagram.com/p/BMkNiYVjK23/
#nervous,sarahdessen,2016-11-08 21:32:45,Can we start drinking now? Asking for me. #ElectionNight #nervous
#nervous,Cristellaaaa,2016-11-08 21:22:43,Season finale of America tonight #nervous
#nervous,jess_rowland14,2016-11-08 21:02:54,I just ate two doughnuts. How's your Election Day? #nervous
#nervous,tinyneenja,2016-11-08 20:53:31,"I voted, and I'm taking the first part of my Apple certification exam! #nervous #womenintech pic.twitter.com/a55bt8RAd4"
#nervous,MrsDianeMcVeigh,2016-11-08 20:24:00,I spy with my little eye something SO BIG. First episode!!! Thank you Sherlock @_stojko #McHart #nervous #kurtmcveigh @thegoodfight pic.twitter.com/13drfmYkPz
#nervous,coryeustice,2016-11-08 20:05:17,I just published “Purposeful Hiring at Hart” https:// medium.com/hart-inc/purpo seful-hiring-at-hart-c6d32d5c810#.xsf0lle48 … #firstpost #nervous @hart
#nervous,fictionlass,2016-11-08 20:04:48,Three hours until the first polls close... #nervous
#nervous,TessaKeough,2016-11-08 19:28:38,#Ivoted I called & canvassed I donated & I am entering the data later today I am #optimistic and #nervous - we can do this Dems #voteblue https:// twitter.com/LiberalAnna/st atus/796005944165535744 …
#nervous,susankurtz,2016-11-08 19:07:44,I literally have no idea how the rest of the day is going to pan out. #ElectionDay #myvote2016 #voted #USElection2016 #nervous
#nervous,thefrostery,2016-11-08 18:52:47,On route to @MittonHall #TWIA2017 #nervous
#nervous,HeatonHouseFarm,2016-11-08 17:40:28,Here goes... #nervous #TWIA2017 @TWIA_Official pic.twitter.com/La7vCvSsfi
#nervous,CullifordHouseA,2016-11-08 17:16:17,Im running a big #DementiaFriends session at @bournemouthuni tomorrow #Excited #Nervous #DementiaChampion #ListenLoveLaugh @DementiaFriends
#nervous,Dr_Christy,2016-11-08 16:58:29,Join me for a Special #Stress Less Live Stream at 11am CST on Facebook @HealthWorksTX #worry #anxiety #nerves #nervous #feelbetter #wellness
#nervous,Jesslouisekirby,2016-11-08 16:50:20,Proud to be with @cirklepr at tonight's @PRCA_Awards - up for 2: Medium Consultancy and Young Communicator #nervous pic.twitter.com/dxAqYV0MPQ
#nervous,karaligar,2016-11-08 16:41:32,I like to think America will make the right choice...I hope the electoral college will too ... I think this is the worst day ever #nervous
#nervous,baileebeshires,2016-11-08 14:04:38,"Honestly, the biggest issue for me is the possibility of Bill Clinton becoming First Gentleman. #nervous"
#nervous,sreddy1215,2016-11-08 13:27:00,I don't even live in the states and I have anxiety over this election. #Election2016 #nervous
#nervous,YourShaddow2,2016-11-08 12:52:00,I am already too stressed out and today is just getting started. #Interview #Nervous #ElectionDay #Longlines #VeryNervous #ImWithHer
#nervous,pear_lina,2016-11-08 12:21:09,chosen to participate in an incoming bowling competition but not that capable #nervous
#nervous,s_rlewis,2016-11-08 10:34:58,Got my first chronic pain clinic appointment today!! Wish me luck! #nervous
#nervous,DympnaArmitage,2016-11-08 10:24:18,#goodluck who ever wins #Election16 #America all the eyes of the world will be watching #nervous #Ireland @GMA @HFA @TeamTrump #votescount pic.twitter.com/22jToKFAWT
#nervous,suzandelibasic,2016-11-08 10:22:49,Those #Election2016 feels! #Nervous pic.twitter.com/jVs5uN8Qu0
#nervous,misscocojade,2016-11-08 10:22:49,Ordered my dress from @LipsyLondon today! Hope I get it before the weekend - eeeeeek! #nervous
#nervous,dominocean,2016-11-08 10:07:53,A little @sharktoons #humor this #Election2016 day! The world will miss you @POTUS - Feeling #nervous - Good luck #America ! pic.twitter.com/0Hkgng21bF
#nervous,Brandicandi80,2016-11-08 10:05:50,"I'll be at the polls when they open so I can enjoy my day off. In about 12 hours or so, we will know who will lead our country. #nervous"
#nervous,NeceeyG,2016-11-08 09:57:35,I need for Clinton to beat Trump in such a way that it restores my faith in the American people. #Nervous #ImWithHer #VOTEHILLARY
#nervous,Nicole_Rymer,2016-11-08 09:48:14,"my #needle for my #foot is tomorrow & im getting more #nervous by the #hour . I dont want it, but have to so i can walk like a #human again. pic.twitter.com/cLXVRrQdVa"
#nervous,DomSalvaggio,2016-11-08 09:46:18,The next 24 hours on twitter is going to be the Greatest ShitShow on Earth. #Election2016 #ElectionNight #nervous
#nervous,Quranqs,2016-11-08 09:41:56,When you get #ill do not get #Nervous about it and try as much as possible to be #Hopeful . Hazrat #Ali (R.A) http:// bit.ly/1PgtFLO pic.twitter.com/2koMIzriNW
#nervous,SueyMcLachlan,2016-11-08 09:41:27,I'm not into politics at all or even from the US but I'm like a moth to a flame with #Election2016 coverage right now! #nervous Anyone else?
#nervous,getpipfit,2016-11-08 09:33:05,First PT session (for me) with @elitefitness_1 this morning. #excited #nervous #ready #letsdothis #postop #getpipfit
#nervous,Sixxinski89,2016-11-08 09:23:58,Interview nerves are kicking in #nervous
#nervous,Emmafoster83,2016-11-08 09:20:51,Eeek #nervous another chapter in my business today
#nervous,Chantal_T420,2016-11-08 09:19:36,; need to fuckin sleep but i aint tired #nervous #wreck
#nervous,champers1631,2016-11-08 09:17:33,I am off to get my fat arse whooped at the gym!! #nervous
#nervous,williamphotopro,2016-11-08 09:14:40,#newtonprogramme #singaporenewtonprogrammelesson #aroundthecorner Is getting closer #nervous #OMG #newtoninternationalcollege #singapore
#nervous,Liz_Bardwell,2016-11-08 09:14:10,"Please America, the rest of the world is counting on you to get it right #please #nervous #Election2016 pic.twitter.com/G2sniBLN4l"
#nervous,officialguyguru,2016-11-08 09:13:54,Vote Hillary!!!! #Election2016 #HillaryClinton #vote #PresidentialElection #president #usa #nervous #dotherightthingamerica #GoHillary pic.twitter.com/v3YkxHkFol
#nervous,SiTrinder,2016-11-08 09:06:07,My first performance tonight in 7 years at my theatrical home @TheRSC #nervous #dontrememberstagelightsbeingsobright
#nervous,tashaj151,2016-11-08 09:02:39,"Today is the day, first wedding hair trial and then I get to see my dress for the first time #excited #nervous #bride"
#nervous,PlanetWithS,2016-11-08 08:46:16,"Election Day. If I don't watch it, will it still happen? #nervous"
#nervous,YogaLoveShop,2016-11-08 08:22:23,Become a #Confident Man to get your lady http:// bit.ly/1TnEChW #motivation #INeedConfidence #nervous #dating pic.twitter.com/JFaCJkMJyE
#nervous,oldtimerdelta,2016-11-08 07:40:50,new headline #sacramento #policeman stands next to a #petrified / #nervous #YoungBlackMale #mediawatch #mediachat #media #fuck #this shit https:// twitter.com/ABC10/status/7 95893383273119744 …
#nervous,bronder,2016-11-08 07:12:03,#nervous
#anxious,ahmednkhan,2016-11-16 16:50:03,#anxious Feet to just wait To dance in your direction @poemprose @HecatesLove13 @suzannahbaron @sandrafine2b @ranianahmed @Malik4Fareeha pic.twitter.com/eKuTesgbQE
#anxious,trlblzr969,2016-11-16 12:46:08,"OK, Saturday is the last day for me to get my first Bow Buck, and first deer since 1985. About ready to shoot anything. #frustrated #anxious"
#anxious,IsaacSturdevant,2016-11-15 23:35:30,"I don't mean to alarm anyone, but these new tracks are better than you could imagine. @BSturg_ @269Kidd_O #TrapHouse2 #Anxious #269"
#anxious,xephyr5,2016-11-15 15:00:28,"i'm going blind, but one thing's clear death is the only salvation you'll feel ...... #emo #depression #anxiety #anxious #anxietyproblems"
#anxious,drudgeheadlines,2016-11-10 01:47:59,#Immigration #Lawyers Face #Anxious Clients... http://www. bloomberg.com/news/articles/ 2016-11-09/immigration-lawyers-fear-the-worst-face-anxious-clients-after-trump-victory …
#anxious,drudgeheadlines,2016-11-10 01:26:00,' #Anxious and #fearful ' #students demand day off to cry... https://www. campusreform.org/?ID=8367
#anxious,KenHerron,2016-11-09 21:19:44,Feeling a little #anxious today #LinkedIn ? #Facebook is testing #joblistings - https:// techcrunch.com/2016/11/07/job book/ … ! #SoSoShow pic.twitter.com/obdiSI1bGh
#anxious,xbeaureedx,2016-11-09 21:18:18,I promised #leather this week but I'm still #anxious about the #electionday results #allintheface pic.twitter.com/VeX8hv5dU1
#anxious,DearRouge,2016-11-09 08:39:57,Having a hard time wrapping our heads around who the president of the United States is. How did this happen?! #anxious #what ?!? #sayagain ?
#anxious,gustinfangirls,2016-11-09 05:19:24,Staring at the TV tonight like... #Election2016 #sotired #worried #anxious #TellMeNow pic.twitter.com/O3RMnJ2IcB
#anxious,TypeOneChic,2016-11-09 04:26:05,Anyone else's blood sugars fluctuating lol?? #Anxious
#anxious,_ianni,2016-11-09 04:11:51,Today is a scary day. #anxious
#anxious,SamSchacher,2016-11-09 03:56:29,"With the news that Trump's in the lead, the #DOW 's down nearly 700 points. Great job, America... #fearful #anxious #electionnight"
#anxious,TheRealPeachy,2016-11-09 03:15:39,Saw This: AMERICA IS IN LABOR... WAITING TO SEE IF IT'S A BOY OR A GIRL. #ElectionNight #Elections2016 #anxious
#anxious,christylemire,2016-11-09 03:09:07,Fuck it. I'm opening the champagne either way. #anxious #howdidthishappen #ElectionNight
#anxious,colbydeemusic,2016-11-09 02:57:07,I didn't stock up on enough wine for this election! #anxious
#anxious,DrAndreaProulx,2016-11-09 02:42:11,"Feeling #anxious watching US Election? Get up, do 10 jumping jacks to flush out your stress hormones! #uselxncan #stress #anxiety #worrying"
#anxious,MrsMurray15,2016-11-09 02:31:11,I've never been so concerned w/politics (especially that of another country) as I am tonight. #nervewrecking #anxious #ElectionNight
#anxious,jackTweets11,2016-11-09 01:53:15,There's only 1 thing to do right now. MORE SHOTS! #anxious #ElectionNight pic.twitter.com/4T9x7BCnaq
#anxious,ACookseyMusic,2016-11-09 01:01:34,Watching the projections on the news like #anxious #ElectionNight
#anxious,MauroBalcazar,2016-11-09 00:45:29,"Why I feel like im in the ER, waiting to hear if my Country is going to make it or not. #ElectionNight #anxious"
#anxious,ARLYNVM28,2016-11-09 00:44:36,Waiting for the election results like... #ElectionNight #anxious pic.twitter.com/D4R6qGJs2R
#anxious,dorkism_iscool,2016-11-09 00:43:54,This election is like seeing the texting bubble from a crush after exposing your feelings. Do you like me or nah? #ElectionNight #Anxious
#anxious,LaurenWardReed,2016-11-09 00:41:20,At my fave bar with my fave people watching the election. Not sure if I can stomach this. #anxious #Election2016 #ImWithHer
#anxious,QueenStivers,2016-11-09 00:13:37,I thought it would be fun to watch the votes come in but really it's just making me sick. #anxious
#anxious,AmyHoogervorst,2016-11-09 00:00:21,Are you #anxious tonight? Did you #vote ? Then it is out of your hands. Worry and rumination only cause suffering. Take good care of you.
#anxious,shwamusic,2016-11-08 23:36:26,I'm on my third La Croix of the day. #anxious
#anxious,NelsonRochaNYC,2016-11-08 23:28:16,"Tonight will go down as the greatest day in history, Woman President, or the year the US became the joke of the world #anxious #electionday"
#anxious,JulieFalatko,2016-11-08 22:35:49,YES HELLO IT IS DARK OUTSIDE CAN I HAVE ELECTION RESULTS NOW. #waiting #anxious #canidrinkyet
#anxious,pruchy2,2016-11-08 22:24:15,Being this far ahead of polls closing is painful. Election Day is too long from abroad! #anxious
#anxious,failraiser,2016-11-08 22:14:44,So um.... who got them Presidential spoilers #anxious
#anxious,GuidanceGirlEm,2016-11-08 21:24:06,#ElectionDay got U feeling #anxious or stressed? Practice breathing in for 4 counts hold for 1 & out for 4 x4 = less anx #ElectionNight
#anxious,Tristypooo,2016-11-08 20:24:45,I'm excited and terrified to find out the election results. #anxious #ElectionDay #TrumpPence16 #hillaryforprison
#anxious,JackieKanePhoto,2016-11-08 20:07:54,That would work! Do you know when new crop will ship? #Anxious :-) https:// twitter.com/corkysnuts/sta tus/796016513224347648 …
#anxious,ImmigrationWS,2016-11-08 19:34:21,Co-workers say that I'm being too savage but they don't understand that dark humor is the only way that can get me through today #anxious
#anxious,Ls182,2016-11-08 18:53:40,Sending love to my American friends please really think about your vote #anxious
#anxious,TTinywaist,2016-11-08 17:02:34,https://www. youtube.com/playlist?list= PLHV8YI4M3_jLuzrfgQp3F3u09qqVpzRxd … Feeling #stressed ? Try a #free #relaxation excerpt! #anxious #stressmanagement #queenof #stressrelief #stress pic.twitter.com/o6UiQSuida
#anxious,rockspringucc,2016-11-08 16:38:46,"Are you #anxious about #ElectionDay ? Join us today between 2-4 p.m. to play with #dogs , have #cookies , spend time in #prayer stations! #vote"
#anxious,cadlymack,2016-11-08 15:22:12,I'm wearing your #anxious shirt today @ColtonLHaynes . It's accurate and also makes me feel safe.
#anxious,nsbulk,2016-11-08 15:12:34,Have they called Florida yet? #anxious #Election2016
#anxious,GLlTTERYSPARK,2016-11-08 15:01:09,"People are always wanting my help with homework. And yet, no one ever helps me. #SadTimes #Anxious"
#anxious,AndyPierrotti,2016-11-08 14:37:49,Fellow newsies - am I the only journalist who didn't sleep well last night...& there's a good chance it will be a late night #anxious #vote
#anxious,urUnconditional,2016-11-08 14:37:17,#Anxious pic.twitter.com/dU0JavfjU8
#anxious,MapleLeafAussie,2016-11-08 13:50:33,Seems like a good share for a night when I am #awake and #anxious about #Election2016 #VoteResponsibly #pantsuitnation https:// twitter.com/jvlpoet/status /795563641118474240 …
#anxious,drfrancs,2016-11-08 13:39:08,Excited for tomorrows ending... #anxious
#anxious,The_Chosen_0ne_,2016-11-08 13:32:09,#anxious about the results tonight
#anxious,wondersinwind,2016-11-08 13:30:41,#Anxious about the election? Distract yourself momentarily with a comic I made! #NaBloPoMo #ElectionDay #comics https:// wondersinthewind.wordpress.com/2016/11/08/com ic-publishing-trash/ …
#anxious,JamiGibbs,2016-11-08 13:28:10,"I early voted so I'm just going to spend the day hovering over everyone, whispering, ""Go vote"". #ElectionDay #anxious"
#anxious,JasmineVilla,2016-11-08 13:21:22,This #election has me so #anxious #hill or #jill what to do.
#anxious,grib1,2016-11-08 13:13:33,Discovered I can stay at peak heart rate even running slowly on the treadmill if I watch non-stop election coverage. #Fitbit #anxious
#anxious,fischeralanaj,2016-11-08 13:10:47,I feel like i should comment on the fact that it's election day. I guess I just want it to be over. #Anxious
#anxious,youngoldsoul,2016-11-08 12:58:34,"Today's the day I #defend my #thesis ! Wish me luck + good vibes, #Twitter ! #gradschool #anxious #excited #almostDr"
#anxious,Everythng_Beach,2016-11-08 12:57:15,Today is the day! #anxious #usa #vote #pray #liveinpeace https://www. instagram.com/p/BMjMrzaAbiq/
#anxious,ManuelMG7,2016-11-08 12:56:21,"It finally arrived, the D Day #ElectionDay #ApocalypseNow #Anxious"
#anxious,JaneDoe_s,2016-11-08 12:53:17,Only 22 days until I embark on my 8.5 month journey I have been planning for 11 months I am #excited #anxious #curios #TravelTuesday pic.twitter.com/ymqXQuR5kE
#anxious,JWILL331,2016-11-08 12:46:28,Today's going to be epic.. #imwithher #America #ElectionNight #anxious
#anxious,GEMSTARRS,2016-11-08 12:34:28,#anxious
#anxious,hem_edu,2016-11-08 11:20:03,In 6 days I will be stepping foot into my first practicum #anxious #teachercandidate #practicum
#anxious,Special_Ism,2016-11-08 10:41:40,"Dear Mom and Dad, It's Me Your #Anxious Kid. via @AnxiousToddlers http:// pubx.co/Es7Mx2"
#anxious,McMer314,2016-11-08 10:32:27,"Dear America, please please PLEASE don't screw this up. Please. #imwithher #anxious #hopeful"
#anxious,ELMacDC44,2016-11-08 10:14:15,My insides right now #anxious pic.twitter.com/fPHaJwJVj6
#anxious,RoyalKingPablo,2016-11-08 10:11:08,"Low key thinking about taking that leap of faith! They have faith in me as an artist. So, why not? #PatientlyWaiting #Anxious #Decisions"
#anxious,DobsonAlison,2016-11-08 10:06:02,"Can't sleep? #Anxious #worrying #insomnia something keeping you awake at night? Try a #lifecoach , clean your life up and clear your head! pic.twitter.com/EUAQOJBFaN"
#anxious,julieg_hr,2016-11-08 09:03:43,#Election2016 #ElectionNight #anxious https:// twitter.com/cnnsitroom/sta tus/795753306094112768 …
#anxious,THECANDYROOM_,2016-11-08 08:54:55,Waiting anxiously #cute #anxious #happytuesday #Vancouver #cute #robsonstreet #happytuesday #plushies #gund pic.twitter.com/u3OOFCYu2W
#anxious,MLC44,2016-11-08 08:03:41,I don't know if I'll be able to sleep tonight... #anxious #imwithher #election2016 #electionday #cantsleep
#tension,CounsellorsCafe,2016-11-16 23:47:05,11 Surprising Signs From Your #Body That You Might Be Suffering From #Anxiety #worry #stress #focus #Tension https://www. bustle.com/articles/19533 4-11-surprising-signs-from-your-body-that-you-might-be-suffering-from-anxiety …
#tension,JonahRobins143,2016-11-16 12:04:42,"#TRE is an effective #tool for releasing chronic #traumatic #stress , physical #tension , and emotional #trauma . pic.twitter.com/6YmhbpFpSg"
#tension,JonahRobins143,2016-11-16 11:45:59,#Tension and #Trauma Releasing #Exercises (TRE) | Jonah Robins #jonahrobins #jonahrobinstrauma http://www. slideshare.net/jonahrobins/te nsion-and-trauma-releasing-exercises-tre-jonah-robins … via @SlideShare
#tension,CitrusRap,2016-11-15 02:00:05,". @SNDNGCHLLZ returns with new music since the release of #Tension . Stream ""Death's Wake"" http:// bit.ly/2fzmRiO pic.twitter.com/foXbkcfH77"
#tension,Daphne_Burki01,2016-11-14 21:44:43,#Tension #scenariodedingue Bravo @JalilLespert https:// twitter.com/sylvain_quimen e/status/798272880777789440 …
#tension,kailee_diaz,2016-11-14 14:38:16,"Hey #writers , check out your #MondayMotivation #writingtip #tension #plotideas #writersofinstagram #writerslife https:// kaileediaz.com/2016/11/14/inc rease-your-novels-tension/ …"
#tension,TheFraternityX,2016-11-14 13:44:06,Release your #Tension with a #DeepBody #Massage by #Healer @SharmaMiller as she works on the #Aches & #Pains ..while easing the #Mind #Joy
#tension,adrianlcano,2016-11-13 17:03:30,Intentando pillar entrada para @losalamosbeach #tension https:// vine.co/v/56WlHEIb2pB
#tension,TensionSkate,2016-11-13 16:41:49,これからはモデルさんの撮影も行ってゆきます！！これからのTENSIONを是非ともお願い致します！ #tension #旅の始まり #ブランド #いいなと思ったらRT #拡散希望 #ウェブサイト #web #ストリート系 #streetbrand #ストリートブランド pic.twitter.com/pfhmfzGpoF
#tension,Geetprj,2016-11-13 13:41:19,"दिनभरी कामको थकान बेलुका घर आयो एकछिन Twiter मा बस्छु भन्यो समय गैहाल्छ, अनी पढ्ने कहिले हो?? #Tension"
#tension,MandarinMothers,2016-11-13 09:44:22,#Stress #Tension #Anxiety #Pain .... Perhaps #MandarinTherapies can help you. Don't suffer in silence #LincsConnect pic.twitter.com/mwvtvhXWL2
#tension,IACWoman,2016-11-12 22:38:16,"#Dancing is a fun way to release #tension , shift your mood, #relax , & improve your #health . #joy #WUVIP pic.twitter.com/gG5bjg2tsO"
#tension,HandWSC,2016-11-12 18:17:47,The stands are beginning to fill up @HandWSC @Natswimleague Prem Div Rd2... #tension !
#tension,radiookapi,2016-11-12 16:17:31,Tension à la frontière entre le Rwanda et la RDC après un meurtre http://www. radiookapi.net/2016/11/12/act ualite/securite/tension-la-frontiere-entre-le-rwanda-et-la-rdc-apres-un-meurtre … #Tension #Rwanda #RDC #frontière #Gisenyi pic.twitter.com/aoMmxgAO8u
#tension,rij79,2016-11-11 09:27:29,This is what people wanted #uncertainty #tension feeling of drastic steps #surgical etc !! So be it !! Madness and chaos
#tension,CFECGC,2016-11-10 17:59:16,SFR: le comité de groupe suspendu #tension #dialoguesocial #plansocial @SFRcESTMOI http://www. lefigaro.fr/flash-eco/2016 /11/10/97002-20161110FILWWW00207-sfr-le-comite-de-groupe-suspendu.php …
#tension,JonahRobins143,2016-11-10 07:50:21,#Tension Releasing #Exercise is a revolutionary process that helps people to safely unwind chronic #tension patterns in the #body & #relax . pic.twitter.com/j19HplhMzJ
#tension,dobara_mt_pchna,2016-11-09 15:42:24,Ghr walon ko #Tension hai k Is ko kon mile gi Aur Doston ko #Tension hai k Is ko aur kitni milen gi..
#tension,micofvlc,2016-11-09 07:00:03,¡Buenos días! ¿Sabes cómo tomarte correctamente la #tensión en casa? Hoy os mostramos algunos de los errores más frecuentes. #consejosmicof pic.twitter.com/b4k8dCuUJr
#tension,trummer_philipp,2016-11-09 00:33:28,#Florida is ned gut für meine Nerven #ElectionNight #tension
#tension,BishopCVaughn,2016-11-08 23:52:27,"That sound on CNN and Wolf says ""we have an election alert"". Makes my stomach drop! #tension"
#tension,andreammscott,2016-11-08 22:10:57,I can't wait to see what kind of play David Hare will write after this election #playwright #tension
#tension,NorthantsSports,2016-11-08 21:42:51,Kemp sends Cornell the wrong way (2-3).O'Toole must score #Tension
#tension,AamAadmiNotAAP,2016-11-08 18:48:30,"Aam aadmi:badi mushkil se asli aur nakali note pahchanana sikha tha, fir se naye note nikal diye #Tension #BlackMoney #currencyban #Currency"
#tension,AuthorShout,2016-11-08 18:45:28,Unsettling #tension finally came to an uneasy truce http:// ow.ly/h974305XdBf #asmsg #iartg #glory #joy #amreading @Mtmagee1013M pic.twitter.com/RYBrAHPZpP
#tension,guruhulan,2016-11-08 16:16:03,I am fine at my house #tension #future my BP travel daily 30 30 evening teaching all 70km restless pic.twitter.com/2BxYkS6aXJ
#tension,Delhi_king,2016-11-08 16:10:43,"People take #Tension for their 500/1000,I am worried abt my three Rs 10 coins.. #trueindian @narendramodi"
#tension,TheRealLadyRin,2016-11-08 14:35:59,There is a level of #tension in the air this morning at my #polling place. Everyone seems #nervous #VOTE
#tension,PHILIPAMITCHELL,2016-11-08 14:30:29,#Tension The first Presidential Election where my moral & biblical convictions hinder me from wanting to vote for either candidate. Jesus.
#tension,Nesgodraa,2016-11-08 14:00:07,"Creo, que el peor momento de un ilustrador es cuando das un presupuesto a un cliente y tardan mucho tiempo en responderte XDDD #Tension"
#tension,MatuteMadryn,2016-11-08 13:28:41,La municipalidad no quiere limpiar las algas... #Tension https:// twitter.com/IgnaAgulleiro/ status/795980910894125060 …
#tension,EraldoMaglara,2016-11-08 12:25:12,How to Release #Tension & Keep #Muscles #Healthy http:// ow.ly/5tq2305UOnL via @angienewton
#tension,alertarojanot,2016-11-08 12:12:41,OTAN pone en alerta máxima a 300 mil soldado ante tensión con Rusia 08-11-2016 #OTAN #TENSION #RUSIA #GUERRA ... http:// fb.me/1FtHC3aSQ
